{
  "$schema": "https://json-schema.org/draft/2020-12/schema",
  "$id": "https://schemas.intelliger.ai/oati/v1/service-discovery.schema.json",
  "title": "OATI Service Discovery Document",
  "type": "object",
  "additionalProperties": false,
  "required": ["oati_version", "id", "organisation_id", "issuer", "display_name", "endpoints", "accepted_profiles", "status", "issued_at"],
  "properties": {
    "oati_version": { "const": "1.0" },
    "id": { "type": "string", "pattern": "^oati:service:[A-Za-z0-9._:-]+$" },
    "organisation_id": { "type": "string", "pattern": "^oati:org:[A-Za-z0-9._:-]+$" },
    "issuer": { "type": "string", "pattern": "^oati:issuer:[A-Za-z0-9._:-]+$" },
    "display_name": { "type": "string", "minLength": 1, "maxLength": 200 },
    "description": { "type": "string", "maxLength": 2000 },
    "endpoints": {
      "type": "array", "minItems": 1, "maxItems": 32,
      "items": {
        "type": "object", "additionalProperties": false,
        "required": ["id", "url", "protocol", "audience"],
        "properties": {
          "id": { "type": "string", "pattern": "^[A-Za-z0-9._-]{1,64}$" },
          "url": { "type": "string", "format": "uri", "pattern": "^https://" },
          "protocol": { "enum": ["http", "grpc", "mcp", "a2a"] },
          "audience": { "type": "string", "minLength": 1, "maxLength": 512 },
          "actions": { "type": "array", "items": { "type": "string", "minLength": 1 }, "uniqueItems": true, "maxItems": 128 },
          "accepted_profiles": { "type": "array", "items": { "type": "string", "minLength": 1 }, "uniqueItems": true, "maxItems": 64 },
          "priority": { "type": "integer", "minimum": 0, "maximum": 65535 },
          "regions": { "type": "array", "items": { "type": "string", "pattern": "^[A-Z]{2}$" }, "uniqueItems": true }
        }
      }
    },
    "accepted_profiles": { "type": "array", "items": { "type": "string", "minLength": 1 }, "uniqueItems": true, "maxItems": 64 },
    "status": { "enum": ["active", "suspended", "revoked"] },
    "issued_at": { "type": "string", "format": "date-time" },
    "expires_at": { "type": "string", "format": "date-time" },
    "proof": { "$ref": "proof.schema.json" }
  }
}
